{
  "$schema": "../../../../tools/units/unit.schema.json",
  "schemaVersion": 1,
  "type": "remove-audio",
  "label": "Remove Audio",
  "category": "processing",
  "position": { "after": "audio-sync" },
  "picker": {
    "family": "video-sound",
    "after": "extract-audio",
    "pickerCategory": "Processing",
    "keywords": ["remove audio", "mute", "strip audio", "silent video", "delete audio", "no sound", "detach audio", "split video audio"]
  },
  "handles": {
    "inputs": [{ "id": "in", "label": "Video", "accepts": ["video"], "field": "videoUrl" }],
    "outputs": [{ "id": "video-out", "label": "Video", "kind": "video", "from": "generatedVideoUrl" }]
  },
  "defaultData": { "label": "Remove Audio", "fieldMappings": {} },
  "execution": {
    "kind": "worker",
    "queue": "video",
    "requires": { "anyOf": ["videoUrl"], "kind": "video", "noun": "a video" }
  },
  "capabilities": ["ffmpeg-media", "panel:generate-button", "finalize:own-writer", "length:exact-video"],
  "registry": {
    "description": "Strip the audio track from a video, leaving a silent clip (stream-copied, lossless).",
    "outputType": "video",
    "after": "manual-edit"
  },
  "contract": { "producer": "video" },
  "docs": {
    "page": "docs/nodes/processing-video/remove-audio.md",
    "index": "hand-written",
    "useCase": "Mute a clip losslessly before adding new sound"
  }
}
